{
  "schema_version": 1,
  "graph_id": "graph_ai_agent_tui_v1",
  "name": "AI Agent TUI development",
  "objective": "Develop a secure dependency-free operator TUI for ProofGraph AI agent runs. It must list runs; render graph nodes, agent state, events, failures, integrity, and approvals; inspect selected nodes; support pause, resume, and single-step through debugger APIs; approve or deny pending approvals and abort runs only through bounded double-key confirmation; restore terminal state on every exit path; provide responsive wide, narrow, and non-interactive snapshot modes; and pass functional plus adversarial independent verification.",
  "entry_node": "triage",
  "nodes": [
    {
      "node_id": "triage",
      "title": "Classify TUI scope and risk",
      "kind": "triage",
      "role": "system",
      "tool_policy": [
        "proofgraph"
      ],
      "metadata": {
        "auto": true,
        "initial_route": "research",
        "assessment": {
          "mode": "explicit",
          "signals": {
            "complexity": 82,
            "uncertainty": 50,
            "risk": "medium",
            "requires_research": true,
            "requires_implementation": true,
            "estimated_subtasks": 8,
            "verification_strength": "deep"
          },
          "recommendation": {
            "initial_route": "research",
            "post_approval_route": "research",
            "research_fanout": 3,
            "verification_strength": "deep",
            "max_iterations": 4,
            "max_parallel_nodes": 3,
            "max_dynamic_nodes": 16,
            "human_approval_required": false,
            "model_tiers": {},
            "reason_codes": [
              "template:agent-tui"
            ]
          }
        }
      }
    },
    {
      "node_id": "research-runtime",
      "title": "Research ProofGraph run, debugger, and inspector contracts",
      "kind": "research",
      "role": "researcher",
      "max_attempts": 2,
      "agent_type": "proofgraph-claude:graph-researcher",
      "model_tier": "standard",
      "tool_policy": [
        "proofgraph",
        "workspace_read"
      ],
      "dynamic": true,
      "metadata": {
        "focus": "runtime-contracts"
      }
    },
    {
      "node_id": "research-ux",
      "title": "Research terminal interaction and accessibility constraints",
      "kind": "research",
      "role": "researcher",
      "max_attempts": 2,
      "agent_type": "proofgraph-claude:graph-researcher",
      "model_tier": "standard",
      "tool_policy": [
        "proofgraph",
        "workspace_read"
      ],
      "dynamic": true,
      "metadata": {
        "focus": "terminal-ux"
      }
    },
    {
      "node_id": "research-safety",
      "title": "Research operator control and fail-closed safety boundaries",
      "kind": "research",
      "role": "researcher",
      "max_attempts": 2,
      "agent_type": "proofgraph-claude:graph-researcher",
      "model_tier": "deep",
      "tool_policy": [
        "proofgraph",
        "workspace_read"
      ],
      "dynamic": true,
      "metadata": {
        "focus": "security-and-integrity"
      }
    },
    {
      "node_id": "plan",
      "title": "Design TUI architecture and acceptance contract",
      "kind": "plan",
      "role": "planner",
      "max_attempts": 4,
      "join": "all",
      "agent_type": "proofgraph-claude:graph-planner",
      "model_tier": "deep",
      "tool_policy": [
        "proofgraph",
        "workspace_read"
      ],
      "metadata": {
        "join_from": [
          "research-runtime",
          "research-ux",
          "research-safety"
        ],
        "deliverables": [
          "verified-view-model",
          "responsive-renderer",
          "keyboard-controller",
          "approval-and-abort-controls",
          "failure-and-integrity-inspector",
          "snapshot-mode",
          "terminal-restoration",
          "tests-and-operator-guide"
        ],
        "acceptance_contract": [
          "No direct state.json mutation from the TUI",
          "Pause, resume, and step use DebuggerController only",
          "Approve, deny, and abort use GraphKernel only and require double-key confirmation",
          "Corrupt runs remain visible as integrity_error and cannot crash the UI",
          "Snapshot mode works without a TTY",
          "Interactive exit always restores raw mode, cursor, and alternate screen"
        ]
      }
    },
    {
      "node_id": "develop-model",
      "title": "Implement verified run discovery, node selection, and operator view model",
      "kind": "develop",
      "role": "developer",
      "max_attempts": 4,
      "agent_type": "proofgraph-claude:graph-developer",
      "model_tier": "standard",
      "tool_policy": [
        "proofgraph",
        "workspace_read"
      ],
      "metadata": {
        "component": "model",
        "mutation_mode": "artifact_only",
        "state_contract": [
          "runs",
          "selected_run",
          "selected_node",
          "debugger",
          "approvals",
          "failures",
          "events",
          "integrity"
        ],
        "fail_closed_states": [
          "integrity_error",
          "unknown",
          "malformed"
        ]
      }
    },
    {
      "node_id": "develop-renderer",
      "title": "Implement responsive wide, narrow, and snapshot terminal renderer",
      "kind": "develop",
      "role": "developer",
      "max_attempts": 4,
      "agent_type": "proofgraph-claude:graph-developer",
      "model_tier": "standard",
      "tool_policy": [
        "proofgraph",
        "workspace_read"
      ],
      "metadata": {
        "component": "renderer",
        "mutation_mode": "artifact_only",
        "layouts": [
          "wide",
          "narrow",
          "compact",
          "snapshot"
        ],
        "panels": [
          "runs",
          "graph-and-agents",
          "inspector-and-approvals",
          "events"
        ],
        "terminal_safety": [
          "sanitize-control-sequences",
          "bounded-lines",
          "bounded-width",
          "restore-terminal"
        ]
      }
    },
    {
      "node_id": "develop-controller",
      "title": "Implement navigation, debugger, approval, denial, and abort controls",
      "kind": "develop",
      "role": "developer",
      "max_attempts": 4,
      "agent_type": "proofgraph-claude:graph-developer",
      "model_tier": "standard",
      "tool_policy": [
        "proofgraph",
        "workspace_read"
      ],
      "metadata": {
        "component": "controller",
        "mutation_mode": "artifact_only",
        "commands": [
          "select-run",
          "select-node",
          "pause",
          "resume",
          "single-step",
          "approve",
          "deny",
          "abort",
          "refresh",
          "help",
          "quit"
        ],
        "destructive_confirmation": {
          "type": "same-key-double-press",
          "window_seconds": 4
        },
        "mutation_boundary": "GraphKernel and DebuggerController only"
      }
    },
    {
      "node_id": "verify-functional",
      "title": "Verify rendering, selection, debugger actions, approvals, abort, and snapshot mode",
      "kind": "verify",
      "role": "verifier",
      "max_attempts": 5,
      "agent_type": "proofgraph-claude:graph-verifier",
      "model_tier": "standard",
      "tool_policy": [
        "proofgraph",
        "workspace_read"
      ],
      "metadata": {
        "verification_strength": "standard",
        "acceptance_tests": [
          "wide and narrow panels remain bounded",
          "run and node selection is deterministic",
          "pause, resume, and step call debugger APIs",
          "approve, deny, and abort require two matching keys",
          "snapshot mode works without a TTY",
          "selected node output and Failure Packet are inspectable"
        ]
      }
    },
    {
      "node_id": "verify-adversarial",
      "title": "Adversarially verify corrupt state, terminal injection, confirmation bypass, and cleanup",
      "kind": "verify",
      "role": "verifier",
      "max_attempts": 5,
      "agent_type": "proofgraph-claude:graph-verifier-deep",
      "model_tier": "deep",
      "tool_policy": [
        "proofgraph",
        "workspace_read"
      ],
      "metadata": {
        "verification_strength": "deep",
        "acceptance_tests": [
          "ANSI and control sequence injection is stripped",
          "corrupt or semantically tampered run state is fail-closed",
          "wrong, expired, or mismatched confirmation cannot execute destructive actions",
          "narrow and non-TTY modes do not crash",
          "exceptions and Ctrl-C restore terminal raw mode, cursor, and alternate screen",
          "TUI cannot bypass GraphKernel, approval challenge, or debugger policy"
        ]
      }
    },
    {
      "node_id": "synthesize",
      "title": "Synthesize verified TUI implementation and operations guide",
      "kind": "synthesize",
      "role": "synthesizer",
      "agent_type": "proofgraph-claude:graph-synthesizer",
      "model_tier": "standard",
      "tool_policy": [
        "proofgraph"
      ],
      "metadata": {
        "deliverables": [
          "runnable-operator-tui",
          "explicit-graphspec",
          "automated-tests",
          "adversarial-verification",
          "installation-and-operations-guide"
        ],
        "only_verified_outputs": true
      }
    },
    {
      "node_id": "terminal-success",
      "title": "AI Agent TUI completed",
      "kind": "terminal",
      "role": "system",
      "terminal_status": "success",
      "tool_policy": [
        "proofgraph"
      ],
      "metadata": {}
    },
    {
      "node_id": "terminal-partial",
      "title": "AI Agent TUI partially completed",
      "kind": "terminal",
      "role": "system",
      "terminal_status": "partial",
      "tool_policy": [